timestamp,company,lead_source,qualified,reason
2025-08-13T04:26:23.687513,companyB,google,False,"Thank you for sharing that information. Based on what you've told me, I think you'd be a great fit f"
2025-08-13T04:27:03.903536,companyB,google,False,Excellent! How many years of driving experience do you have?
2025-08-13T04:32:06.900689,companyB,google,False,Excellent! How many years of driving experience do you have?
2025-08-13T04:36:39.648426,companyB,google,False,Excellent! How many years of driving experience do you have?
2025-08-13T04:44:09.221962,companyA,direct,False,Do you have any questions about the company or the position?
